rating; comment
2; Es como si este tema estuviera atrapado en el pasado, no refleja las últimas tendencias en diseño de interfaces.
5; Este tema tiene una gama de colores que simplemente encaja perfectamente.Cada tono parece estar en sintonía con los demás.
4; Me gusta la elección de colores, aunque creo que un pequeño ajuste en la saturación podría mejorar la visibilidad de los elementos clave.Una interfaz visual bien diseñada y agradable.
4; Me gusta la elección de colores, aunque creo que un pequeño ajuste en la saturación podría mejorar la visibilidad de los elementos clave.Una interfaz visual bien lograda.
3; Colores destacados, pero la relación entre ellos podría ser más consistente.
3; Colores singulares, pero la combinación podría ser más equilibrada para un conjunto más sólido.
